{
  "receipt_id": "RECEIPT-YYYYMMDDTHHMMSSZ-example",
  "proposal_id": "PROPOSAL-YYYYMMDDTHHMMSSZ-example",
  "proposal_type": "transition",
  "schema_version": "1.0.0",
  "package_version": "3.7.9",
  "runtime_schema_version": "3.1.1",
  "applied_at": "2026-05-21T00:00:00Z",
  "applied_by": "aso",
  "target_root": "/absolute/path/to/workspace",
  "validators_passed": [
    "proposal_schema",
    "state_verify_before_apply",
    "workspace_identity",
    "base_hash_staleness",
    "state_verify_after_apply",
    "receipt_schema"
  ],
  "base_state_hashes": {
    "project-runtime/state/PROJECT_STATE.json": "sha256:0000000000000000000000000000000000000000000000000000000000000000"
  },
  "result_state_hashes": {
    "project-runtime/state/PROJECT_STATE.json": "sha256:1111111111111111111111111111111111111111111111111111111111111111"
  },
  "applied_operations": [
    {
      "operation_id": "op-001",
      "operation_type": "sidecar_patch",
      "target": "project-runtime/state/NEXT_ACTION.json",
      "status": "applied",
      "description": "Patched a guarded runtime state field."
    }
  ],
  "outcome": "applied"
}
